{
  "id": "chipi-ready",
  "name": "Argent X Account v0.4.0",
  "type": "READY",
  "version": "0.4.0",
  "classHash": "0x036078334509b514626504edc9fb252328d1a240e4e948bef8d0c08dff45927f",
  "network": "starknet_mainnet",
  "license": "MIT",
  "author": {
    "name": "Argent",
    "github": "argentlabs"
  },
  "repository": "https://github.com/argentlabs/argent-contracts-starknet",
  "capabilities": ["multicall", "guardian"],
  "gasOverhead": 1.0,
  "standards": {
    "src5": true,
    "src6": true
  },
  "interfaces": ["SRC5", "SRC6"],
  "audit": {
    "audited": true,
    "firm": "Argent Security",
    "result": "pass"
  },
  "deprecated": false,
  "supersededBy": null
}
